{
  "schemaVersion": 1,
  "sku": "DKT-DOC-007",
  "idTecnico": "artisys-video-engine",
  "slug": "processamento-e-edicao-de-video",
  "nome": "Processamento e Edição de Vídeo",
  "descricao": "Executa jobs e timelines locais para processamento e composição de vídeo.",
  "categoria": "Documentos e Mídia",
  "versao": "0.1.0",
  "estadoTecnico": "implemented",
  "estadoComercial": "preparando",
  "origem": {
    "repositorio": "nutricionistaalmeidavh-spec/utilidades",
    "caminho": "modules/artisys-video-engine",
    "commit": null
  },
  "runtime": [],
  "dependenciaPagaObrigatoria": false,
  "dependenciasOpcionais": [],
  "upstreams": [],
  "inclui": [
    "código-fonte do módulo",
    "documentação do kit",
    "exemplo/testes quando disponíveis na origem"
  ],
  "naoInclui": [
    "serviços pagos de terceiros",
    "credenciais",
    "infraestrutura always-on obrigatória"
  ],
  "comandosValidacao": [],
  "precoSugeridoBRL": null,
  "documentacaoConferida": false,
  "licencasConferidas": false,
  "build": {
    "habilitado": true
  },
  "zip": "processamento-e-edicao-de-video-v0.1.0.zip"
}
