{
  "schemaVersion": 1,
  "sku": "DKT-PLAT-009",
  "idTecnico": "artisys-settings",
  "slug": "configuracoes-do-sistema",
  "nome": "Configurações do Sistema",
  "descricao": "Centraliza preferências, valores padrão e configurações separadas por namespace.",
  "categoria": "Plataforma e Dados",
  "versao": "0.1.0",
  "estadoTecnico": "implemented",
  "estadoComercial": "preparando",
  "origem": {
    "repositorio": "nutricionistaalmeidavh-spec/utilidades",
    "caminho": "modules/artisys-settings",
    "commitSnapshot": "9bca8b29f3a5875433b42d01ceb84e743dabba82",
    "importadoEm": "2026-09-28T22:46:20.930Z"
  },
  "runtime": [],
  "dependenciaPagaObrigatoria": false,
  "dependenciasOpcionais": [],
  "upstreams": [],
  "inclui": [
    "código-fonte do módulo",
    "documentação do kit",
    "exemplo/testes quando disponíveis na origem"
  ],
  "naoInclui": [
    "serviços pagos de terceiros",
    "credenciais",
    "infraestrutura always-on obrigatória"
  ],
  "comandosValidacao": [],
  "precoSugeridoBRL": null,
  "documentacaoConferida": false,
  "licencasConferidas": false,
  "build": {
    "habilitado": true
  },
  "zip": "configuracoes-do-sistema-v0.1.0.zip"
}
