{
  "schemaVersion": 1,
  "sku": "DKT-DESK-003",
  "idTecnico": "artisys-serialport",
  "slug": "integracao-com-dispositivos-seriais",
  "nome": "Integração com Dispositivos Seriais",
  "descricao": "Conecta balanças, gavetas e outros equipamentos por porta serial.",
  "categoria": "Desktop e Hardware",
  "versao": "0.1.0",
  "estadoTecnico": "implemented",
  "estadoComercial": "preparando",
  "origem": {
    "repositorio": "nutricionistaalmeidavh-spec/utilidades",
    "caminho": "modules/artisys-serialport",
    "commitSnapshot": "9bca8b29f3a5875433b42d01ceb84e743dabba82",
    "importadoEm": "2026-09-28T22:46:20.930Z"
  },
  "runtime": [],
  "dependenciaPagaObrigatoria": false,
  "dependenciasOpcionais": [],
  "upstreams": [],
  "inclui": [
    "código-fonte do módulo",
    "documentação do kit",
    "exemplo/testes quando disponíveis na origem"
  ],
  "naoInclui": [
    "serviços pagos de terceiros",
    "credenciais",
    "infraestrutura always-on obrigatória"
  ],
  "comandosValidacao": [],
  "precoSugeridoBRL": null,
  "documentacaoConferida": false,
  "licencasConferidas": false,
  "build": {
    "habilitado": true
  },
  "zip": "integracao-com-dispositivos-seriais-v0.1.0.zip"
}
