{
  "schemaVersion": 1,
  "sku": "DKT-UI-003",
  "idTecnico": "artisys-dashboard",
  "slug": "paineis-e-indicadores",
  "nome": "Painéis e Indicadores",
  "descricao": "Monta dashboards, painéis redimensionáveis, grades e visualizações de dados.",
  "categoria": "Interface e Produtividade",
  "versao": "1.0.0",
  "estadoTecnico": "stable",
  "estadoComercial": "preparando",
  "origem": {
    "repositorio": "nutricionistaalmeidavh-spec/utilidades",
    "caminho": "modules/artisys-dashboard",
    "commitSnapshot": "9bca8b29f3a5875433b42d01ceb84e743dabba82",
    "importadoEm": "2026-09-28T22:46:20.930Z"
  },
  "runtime": [],
  "dependenciaPagaObrigatoria": false,
  "dependenciasOpcionais": [],
  "upstreams": [],
  "inclui": [
    "código-fonte do módulo",
    "documentação do kit",
    "exemplo/testes quando disponíveis na origem"
  ],
  "naoInclui": [
    "serviços pagos de terceiros",
    "credenciais",
    "infraestrutura always-on obrigatória"
  ],
  "comandosValidacao": [],
  "precoSugeridoBRL": null,
  "documentacaoConferida": false,
  "licencasConferidas": false,
  "build": {
    "habilitado": true
  },
  "zip": "paineis-e-indicadores-v1.0.0.zip"
}
