{
  "schemaVersion": 1,
  "sku": "DKT-QUAL-002",
  "idTecnico": "artisys-release",
  "slug": "empacotamento-e-publicacao",
  "nome": "Empacotamento e Publicação",
  "descricao": "Orquestra validações, assinatura, hashes e etapas necessárias para publicar uma versão.",
  "categoria": "Qualidade e Entrega",
  "versao": "0.1.0",
  "estadoTecnico": "implemented",
  "estadoComercial": "preparando",
  "origem": {
    "repositorio": "nutricionistaalmeidavh-spec/utilidades",
    "caminho": "modules/artisys-release",
    "commit": null
  },
  "runtime": [],
  "dependenciaPagaObrigatoria": false,
  "dependenciasOpcionais": [],
  "upstreams": [],
  "inclui": [
    "código-fonte do módulo",
    "documentação do kit",
    "exemplo/testes quando disponíveis na origem"
  ],
  "naoInclui": [
    "serviços pagos de terceiros",
    "credenciais",
    "infraestrutura always-on obrigatória"
  ],
  "comandosValidacao": [],
  "precoSugeridoBRL": null,
  "documentacaoConferida": false,
  "licencasConferidas": false,
  "build": {
    "habilitado": true
  },
  "zip": "empacotamento-e-publicacao-v0.1.0.zip"
}
