{
  "schemaVersion": 1,
  "sku": "DKT-PLAT-015",
  "idTecnico": "artisys-sync",
  "slug": "sincronizacao-de-dados",
  "nome": "Sincronização de Dados",
  "descricao": "Sincroniza alterações offline, aplica tentativas automáticas e resolve conflitos.",
  "categoria": "Plataforma e Dados",
  "versao": "0.2.0",
  "estadoTecnico": "implemented",
  "estadoComercial": "preparando",
  "origem": {
    "repositorio": "nutricionistaalmeidavh-spec/utilidades",
    "caminho": "modules/artisys-sync",
    "commitSnapshot": "9bca8b29f3a5875433b42d01ceb84e743dabba82",
    "importadoEm": "2026-09-28T22:46:20.930Z"
  },
  "runtime": [],
  "dependenciaPagaObrigatoria": false,
  "dependenciasOpcionais": [],
  "upstreams": [],
  "inclui": [
    "código-fonte do módulo",
    "documentação do kit",
    "exemplo/testes quando disponíveis na origem"
  ],
  "naoInclui": [
    "serviços pagos de terceiros",
    "credenciais",
    "infraestrutura always-on obrigatória"
  ],
  "comandosValidacao": [],
  "precoSugeridoBRL": null,
  "documentacaoConferida": false,
  "licencasConferidas": false,
  "build": {
    "habilitado": true
  },
  "zip": "sincronizacao-de-dados-v0.2.0.zip"
}
