{
  "schemaVersion": 1,
  "sku": "DKT-PLAT-001",
  "idTecnico": "artisys-auth-rbac",
  "slug": "acesso-e-permissoes",
  "nome": "Acesso e Permissões",
  "descricao": "Gerencia autenticação local, usuários, papéis, permissões e proteção de ações.",
  "categoria": "Plataforma e Dados",
  "versao": "0.2.0",
  "estadoTecnico": "implemented",
  "estadoComercial": "preparando",
  "origem": {
    "repositorio": "nutricionistaalmeidavh-spec/utilidades",
    "caminho": "modules/artisys-auth-rbac",
    "commitSnapshot": "9bca8b29f3a5875433b42d01ceb84e743dabba82",
    "importadoEm": "2026-09-28T22:46:20.930Z"
  },
  "runtime": [],
  "dependenciaPagaObrigatoria": false,
  "dependenciasOpcionais": [],
  "upstreams": [],
  "inclui": [
    "código-fonte do módulo",
    "documentação do kit",
    "exemplo/testes quando disponíveis na origem"
  ],
  "naoInclui": [
    "serviços pagos de terceiros",
    "credenciais",
    "infraestrutura always-on obrigatória"
  ],
  "comandosValidacao": [],
  "precoSugeridoBRL": null,
  "documentacaoConferida": false,
  "licencasConferidas": false,
  "build": {
    "habilitado": true
  },
  "zip": "acesso-e-permissoes-v0.2.0.zip"
}
