{
  "schemaVersion": 1,
  "sku": "DKT-DESK-001",
  "idTecnico": "artisys-desktop-shell",
  "slug": "estrutura-base-para-aplicativos-desktop",
  "nome": "Estrutura Base para Aplicativos Desktop",
  "descricao": "Padroniza estrutura desktop, deep links, configurações, logs e hooks de atualização.",
  "categoria": "Desktop e Hardware",
  "versao": "0.1.0",
  "estadoTecnico": "implemented",
  "estadoComercial": "preparando",
  "origem": {
    "repositorio": "nutricionistaalmeidavh-spec/utilidades",
    "caminho": "modules/artisys-desktop-shell",
    "commit": null
  },
  "runtime": [],
  "dependenciaPagaObrigatoria": false,
  "dependenciasOpcionais": [],
  "upstreams": [],
  "inclui": [
    "código-fonte do módulo",
    "documentação do kit",
    "exemplo/testes quando disponíveis na origem"
  ],
  "naoInclui": [
    "serviços pagos de terceiros",
    "credenciais",
    "infraestrutura always-on obrigatória"
  ],
  "comandosValidacao": [],
  "precoSugeridoBRL": null,
  "documentacaoConferida": false,
  "licencasConferidas": false,
  "build": {
    "habilitado": true
  },
  "zip": "estrutura-base-para-aplicativos-desktop-v0.1.0.zip"
}
