{
  "schemaVersion": 1,
  "sku": "DKT-ARQ-001",
  "idTecnico": "artisys-capture",
  "slug": "captura-por-camera-e-codigos",
  "nome": "Captura por Câmera e Códigos",
  "descricao": "Captura câmera ou arquivo e lê QR codes, códigos de barras e imagens.",
  "categoria": "Arquivos e Captura",
  "versao": "1.0.0",
  "estadoTecnico": "stable",
  "estadoComercial": "preparando",
  "origem": {
    "repositorio": "nutricionistaalmeidavh-spec/utilidades",
    "caminho": "modules/artisys-capture",
    "commitSnapshot": "9bca8b29f3a5875433b42d01ceb84e743dabba82",
    "importadoEm": "2026-09-28T22:46:20.930Z"
  },
  "runtime": [],
  "dependenciaPagaObrigatoria": false,
  "dependenciasOpcionais": [],
  "upstreams": [],
  "inclui": [
    "código-fonte do módulo",
    "documentação do kit",
    "exemplo/testes quando disponíveis na origem"
  ],
  "naoInclui": [
    "serviços pagos de terceiros",
    "credenciais",
    "infraestrutura always-on obrigatória"
  ],
  "comandosValidacao": [],
  "precoSugeridoBRL": null,
  "documentacaoConferida": false,
  "licencasConferidas": false,
  "build": {
    "habilitado": true
  },
  "zip": "captura-por-camera-e-codigos-v1.0.0.zip"
}
