{
  "schemaVersion": 1,
  "sku": "DKT-ARQ-003",
  "idTecnico": "artisys-files",
  "slug": "organizacao-e-exploracao-de-arquivos",
  "nome": "Organização e Exploração de Arquivos",
  "descricao": "Cria workspaces espelhados em pastas locais com árvore, drag-and-drop, busca e acompanhamento de alterações.",
  "categoria": "Arquivos e Captura",
  "versao": "0.1.0",
  "estadoTecnico": "implemented",
  "estadoComercial": "preparando",
  "origem": {
    "repositorio": "nutricionistaalmeidavh-spec/utilidades",
    "caminho": "modules/artisys-files",
    "commit": null
  },
  "runtime": [],
  "dependenciaPagaObrigatoria": false,
  "dependenciasOpcionais": [],
  "upstreams": [],
  "inclui": [
    "código-fonte do módulo",
    "documentação do kit",
    "exemplo/testes quando disponíveis na origem"
  ],
  "naoInclui": [
    "serviços pagos de terceiros",
    "credenciais",
    "infraestrutura always-on obrigatória"
  ],
  "comandosValidacao": [],
  "precoSugeridoBRL": null,
  "documentacaoConferida": false,
  "licencasConferidas": false,
  "build": {
    "habilitado": true
  },
  "zip": "organizacao-e-exploracao-de-arquivos-v0.1.0.zip"
}
