{
  "schemaVersion": 1,
  "sku": "DKT-PLAT-004",
  "idTecnico": "artisys-feature-flags",
  "slug": "ativacao-controlada-de-funcionalidades",
  "nome": "Ativação Controlada de Funcionalidades",
  "descricao": "Liga ou desliga recursos por padrão, empresa ou usuário sem duplicar código.",
  "categoria": "Plataforma e Dados",
  "versao": "0.1.0",
  "estadoTecnico": "implemented",
  "estadoComercial": "preparando",
  "origem": {
    "repositorio": "nutricionistaalmeidavh-spec/utilidades",
    "caminho": "modules/artisys-feature-flags",
    "commit": null
  },
  "runtime": [],
  "dependenciaPagaObrigatoria": false,
  "dependenciasOpcionais": [],
  "upstreams": [],
  "inclui": [
    "código-fonte do módulo",
    "documentação do kit",
    "exemplo/testes quando disponíveis na origem"
  ],
  "naoInclui": [
    "serviços pagos de terceiros",
    "credenciais",
    "infraestrutura always-on obrigatória"
  ],
  "comandosValidacao": [],
  "precoSugeridoBRL": null,
  "documentacaoConferida": false,
  "licencasConferidas": false,
  "build": {
    "habilitado": true
  },
  "zip": "ativacao-controlada-de-funcionalidades-v0.1.0.zip"
}
