{
  "schemaVersion": 1,
  "sku": "DKT-PLAT-006",
  "idTecnico": "artisys-backup",
  "slug": "backup-e-restauracao",
  "nome": "Backup e Restauração",
  "descricao": "Cria cópias de segurança verificáveis, retenção e checagem de integridade.",
  "categoria": "Plataforma e Dados",
  "versao": "0.2.0",
  "estadoTecnico": "implemented",
  "estadoComercial": "preparando",
  "origem": {
    "repositorio": "nutricionistaalmeidavh-spec/utilidades",
    "caminho": "modules/artisys-backup",
    "commit": null
  },
  "runtime": [],
  "dependenciaPagaObrigatoria": false,
  "dependenciasOpcionais": [],
  "upstreams": [],
  "inclui": [
    "código-fonte do módulo",
    "documentação do kit",
    "exemplo/testes quando disponíveis na origem"
  ],
  "naoInclui": [
    "serviços pagos de terceiros",
    "credenciais",
    "infraestrutura always-on obrigatória"
  ],
  "comandosValidacao": [],
  "precoSugeridoBRL": null,
  "documentacaoConferida": false,
  "licencasConferidas": false,
  "build": {
    "habilitado": true
  },
  "zip": "backup-e-restauracao-v0.2.0.zip"
}
