{
  "schemaVersion": 1,
  "sku": "DKT-PLAT-002",
  "idTecnico": "artisys-alerts",
  "slug": "alertas-e-notificacoes",
  "nome": "Alertas e Notificações",
  "descricao": "Gerencia alertas locais, vencimentos, severidade e notificações internas com estado lido/não lido.",
  "categoria": "Plataforma e Dados",
  "versao": "0.2.0",
  "estadoTecnico": "implemented",
  "estadoComercial": "preparando",
  "origem": {
    "repositorio": "nutricionistaalmeidavh-spec/utilidades",
    "caminho": "modules/artisys-alerts",
    "commit": null
  },
  "runtime": [],
  "dependenciaPagaObrigatoria": false,
  "dependenciasOpcionais": [],
  "upstreams": [],
  "inclui": [
    "código-fonte do módulo",
    "documentação do kit",
    "exemplo/testes quando disponíveis na origem"
  ],
  "naoInclui": [
    "serviços pagos de terceiros",
    "credenciais",
    "infraestrutura always-on obrigatória"
  ],
  "comandosValidacao": [],
  "precoSugeridoBRL": null,
  "documentacaoConferida": false,
  "licencasConferidas": false,
  "build": {
    "habilitado": true
  },
  "zip": "alertas-e-notificacoes-v0.2.0.zip"
}
