{
  "schemaVersion": 1,
  "sku": "DKT-QUAL-007",
  "idTecnico": "artisys-product-qa",
  "slug": "validacao-completa-do-produto",
  "nome": "Validação Completa do Produto",
  "descricao": "Agrupa QA, segurança e contratos de API para validar um produto de ponta a ponta.",
  "categoria": "Qualidade e Entrega",
  "versao": "0.1.0",
  "estadoTecnico": "implemented",
  "estadoComercial": "preparando",
  "origem": {
    "repositorio": "nutricionistaalmeidavh-spec/utilidades",
    "caminho": "modules/artisys-product-qa",
    "commit": null
  },
  "runtime": [],
  "dependenciaPagaObrigatoria": false,
  "dependenciasOpcionais": [],
  "upstreams": [],
  "inclui": [
    "código-fonte do módulo",
    "documentação do kit",
    "exemplo/testes quando disponíveis na origem"
  ],
  "naoInclui": [
    "serviços pagos de terceiros",
    "credenciais",
    "infraestrutura always-on obrigatória"
  ],
  "comandosValidacao": [],
  "precoSugeridoBRL": null,
  "documentacaoConferida": false,
  "licencasConferidas": false,
  "build": {
    "habilitado": true
  },
  "zip": "validacao-completa-do-produto-v0.1.0.zip"
}
